id,Название,Цена со скидкой,Цена без скидки,Бренд,Ссылка
 226934,"Кофе Ambassador Platinum растворимый, 190г",529,639,ITALCO,https://online.metro-cc.ru/products/ambassador-platinum-190g
 226522,"Кофе в капсулах Absolut Drive Espresso Original для кофемашин Dolce Gusto16шт, 96г",359,429,MACCOFFEE,https://online.metro-cc.ru/products/16shth6g-kofe-absolut-espresso-kapsuly-dg
 401114,"Кофе в капсулах Lebo Espresso Collection для кофемашин Nespresso 40шт, 220г",1 469,,TASSIMO,https://online.metro-cc.ru/products/40shth55g-kofe-lebo-espresso-collection-banka
 459849,"Кофе Carraro Crema Italiano в зернах, 1кг",1 749,,JARDIN,https://online.metro-cc.ru/products/v-zernah-caffe-carraro-crema-italiano-1-kg
 459852,"Кофе Fresco Arabica Solo растворимый, 190г",619,,ЖОКЕЙ,https://online.metro-cc.ru/products/kofe-fresco-arabica-solo-rastvorimyy-190g
 218717,"Напиток кофейный Nescafe Cappuccino порционный растворимый (18г x 20шт), 360г",419,589,POETTI,https://online.metro-cc.ru/products/20shth18g-kofeynyy-nap-nescafe-kapuchino-ports-rastv
 459905,"Кофе Julius Meinl Melange Венская коллекция молотый, 220г",549,739,ЧЕРНАЯ КАРТА,https://online.metro-cc.ru/products/kofe-julius-meinl-melange-venskaya-kollektsiya-molotyy-220g
 636529,"Кофе Bushido Red Katana растворимый сублимированный, 100г",789,859,EGOISTE,https://online.metro-cc.ru/products/art_508637
 226339,"Кофе Monarch Лесной орех растворимый, 95г",509,,LEBO,https://online.metro-cc.ru/products/95g-kofe-monarch-lesnoy-oreh-rastvorimyy-st
 227078,"Кофе Monarch карамель растворимый, 95г",509,,MONARCH,https://online.metro-cc.ru/products/95g-kofe-monarch-karamel-rastvorimyy-st
 632120,"Кофе Bushido Sensei в зернах, 227г",599,,ARO,https://online.metro-cc.ru/products/bushido-sensei-227g
 215682,"Кофе Monarch Day&Night декофеинизированный растворимый, 95г",339,389,JARDIN,https://online.metro-cc.ru/products/kofe-monarch-daynight-dekofeinizirovannyy-rastvorimyy-95g
 36574,"Кофе в капсулах Lebo Espresso Italiano для кофемашин Nespresso 40шт, 220г",1 299,,BUSHIDO,https://online.metro-cc.ru/products/40shth55g-kofe-lebo-espresso-italiano-banka
 224712,"Напиток кофейный MacCoffee Latte карамель порционный (22г x 20шт), 440г",309,,MONARCH,https://online.metro-cc.ru/products/20shth22g-kofe-maccoffee-latte-karamel-portsionnyy
 230296,"Кофе Illy Brazil arabica selection в зернах, 250г",1 090,1 499,MONARCH,https://online.metro-cc.ru/products/illy-arabika-250-g
 224714,"Кофе Jardin Eclair в зернах, 1кг",1 399,,MONARCH,https://online.metro-cc.ru/products/jardin-eclair-1000g
 223100,"Кофе Illy без кофеина молотый, 250г",1 399,,ABSOLUT,https://online.metro-cc.ru/products/kofe-illy-bez-kofeina-molotyy-250g
 228244,"Кофе Jardin Dessert Capuccino в зернах, 1кг",1 399,,ЖОКЕЙ,https://online.metro-cc.ru/products/jardin-dessert-capuccino-1000g
 533474,"Кофе Fort в зернах, 1кг",699,,JARDIN,https://online.metro-cc.ru/products/1kg-kofe-fort-zerno
 228421,"Кофе Illy темная обжарка молотый, 250г",1 379,1 569,VERLE,https://online.metro-cc.ru/products/illy-temnaya-obzharka-250g
 505974,"Кофе Carte Noire Voyage au Bresil растворимый, 90г",459,509,ЧЕРНАЯ КАРТА,https://online.metro-cc.ru/products/90g-kofe-carte-noire-voyage-au-bresil-rastvorimyy-stb
 70210,"Кофе Bushido Light Katana растворимый, 100г",899,,NESCAFE,https://online.metro-cc.ru/products/100g-kofe-bushido-light-katana-rastvorimyy
 611605,"Кофе Жокей крепкий растворимый 3в1 (12г x 50шт), 600г",439,,ILLY,https://online.metro-cc.ru/products/50shth12g-kofe-zhokey-krepkiy-3v1-rastvorimyy
 59000,"Кофе Черная Карта Gold растворимый, 190г",429,569,EGOISTE,https://online.metro-cc.ru/products/chernaya-karta-gold-190g
 75973,"Кофе Nescafe Classic растворимый, 95г",179,214,BUSHIDO,https://online.metro-cc.ru/products/nescafe-classic-naturalnyj-st-b-95g
 395462,"Кофе Egoiste Espresso натуральный молотый жареный, 250г",489,,JULIUS MEINL,https://online.metro-cc.ru/products/art_553579
 230300,"Кофе Julius Meinl Юбилейный молотый, 250г",579,,MONARCH,https://online.metro-cc.ru/products/yubilejnyj-julius-meinl-250-g
 629008,"Кофе Dallmayr Prodomo молотый, 250г",599,,KIMBO,https://online.metro-cc.ru/products/dallmayr-prodomo-250-g
 59005,"Кофе в капсулах Lebo Cappuccino для кофемашин Dolce Gusto 16шт, 172г",849,,BUSHIDO,https://online.metro-cc.ru/products/8shth65g8shth15g-kofe-lebo-cappuccino-v-kapsulah
 221902,"Кофе Lebo Extra в зернах, 1кг",1 189,,CARRARO,https://online.metro-cc.ru/products/1kg-kofe-lebo-extra-v-zernah
 218640,"Кофе Jardin Dessert Сup молотый натуральный жареный, 250г",439,,NESCAFE,https://online.metro-cc.ru/products/jardin-naturalnyj-zharenyj-dessert-sup-250g
 388183,"Кофе Kimbo Extra Cream в зернах, 1кг",1 999,,DALLMAYR,https://online.metro-cc.ru/products/kimbo-extra-cream-v-zernah-1-kg
 598958,"Кофе Monarch Gold растворимый, 190г",1 029,,BUSHIDO,https://online.metro-cc.ru/products/kofe-monarch-gold-rastvorimyy-190g
 208701,"Кофе в капсулах Carraro Decerato для кофемашин Nespresso 10шт, 55г",369,399,LAVAZZA,https://online.metro-cc.ru/products/10shtx55g-kofe-carraro-v-alyum-kapsulah-decerato
 226337,"Кофе в капсулах Carraro Intenso для кофемашин Nespresso 10шт, 55г",369,399,CARTE NOIRE,https://online.metro-cc.ru/products/10shtx55g-kofe-carraro-v-alyum-kapsulah-intenso
 70170,"Кофе в капсулах Julius Meinl Lungo Forte Bio для кофемашин Nespresso 10шт, 56г",619,,NESCAFE,https://online.metro-cc.ru/products/10h56g-kofe-julius-meinl-lungo-forte-v-biorazl-kaps
 226521,"Напиток кофейный Carte Noire Cappuccino растворимый 20 пакетиков, 300г",689,,MACCOFFEE,https://online.metro-cc.ru/products/20shth15g-nap-kofeynyy-carte-noire-cappuccino-rastv-ports
 226333,"Кофе Monarch Crema растворимый, 95г",599,,CARTE NOIRE,https://online.metro-cc.ru/products/kofe-monarch-crema-rastvorimyy-95g
 43053,"Кофе Kimbo Caffe crema classico light в зернах, 1кг",2 049,,LAVAZZA,https://online.metro-cc.ru/products/kimbo-dolche-krem-1kg
 226933,"Кофе Julius Meinl без кофеина зерновой, 500г",1 449,1 869,CARRARO,https://online.metro-cc.ru/products/kofe-julius-meinl-bez-kofeina-zernovoy-500g
 226346,"Кофе Nescafe Classic Crema растворимый, 190г",509,,LEBO,https://online.metro-cc.ru/products/190g-kofe-nescafe-classic-crema-rastvorimyy-st-banka
 234392,"Кофе Kimbo Espresso в зернах, 1кг",1 979,,JULIUS MEINL,https://online.metro-cc.ru/products/kimbo-espresso-v-zernah-1-kg
 637203,"Кофе Nescafe Classic растворимый порошкообразный с добавлением натурального жареного молотого кофе, 750г",1 799,,L'OR,https://online.metro-cc.ru/products/750g-kofe-nescafe-classic-rastvorimyy
 553579,"Кофе Jardin Colombia Medelin растворимый сублимированный, 150г",499,,EGOISTE,https://online.metro-cc.ru/products/jardin-sublimirovannyj-colombia-medelin-150g
 228440,"Кофе Fresco Arabica blend молотый, 250г",499,,VERLE,https://online.metro-cc.ru/products/kofe-fresco-arabica-blend-molotyy-250g
 439335,"Кофе Poetti Leggenda Espresso в зернах, 1кг",2 189,,FRESCO,https://online.metro-cc.ru/products/1kg-kofe-poetti-leggenda-espresso-v-zernah
 201559,"Кофе Жокей Империал натуральный растворимый сублимированный, 150г",269,349,JACOBS,https://online.metro-cc.ru/products/zhokej-imperial-150g
 227302,"Кофе Verle Decaf в дрип-пакетах 6шт, 66г",449,,ЧЕРНАЯ КАРТА,https://online.metro-cc.ru/products/6shth11g-kofe-verle-decaf-v-drip-paketah
 226335,"Кофе в капсулах Carraro Dolci arabica для кофемашин Nespresso 10шт, 55г",369,399,CARTE NOIRE,https://online.metro-cc.ru/products/10shtx55g-kofe-carraro-v-alyum-kapsulah-dolci-arabica
 384608,"Кофе Жокей По-восточному молотый натуральный жареный, 250г",299,,JULIUS MEINL,https://online.metro-cc.ru/products/art_373046
 298849,"Кофе Verle Central America в дрип-пакетах 6шт, 66г",419,,DALLMAYR,https://online.metro-cc.ru/products/6shth11g-kofe-verle-central-america-v-drip-paketah
 209743,"Кофе Egoiste Private растворимый, 100г",849,999,EGOISTE,https://online.metro-cc.ru/products/100g-kofe-egoiste-private-rastvorimyy
 227974,"Кофе в капсулах Jacobs Espresso №10 Intenso для кофемашин Nespresso 10шт, 52г",279,329,FRESCO,https://online.metro-cc.ru/products/jacobs-espresso-10-intenso-10sht
 201564,"Кофе Origo Professional Star эспрессо в зернах, 1кг",2 169,,JACOBS,https://online.metro-cc.ru/products/1kg-kofe-origo-professional-star-espresso-zerno
 100815,"Кофе Jardin Colombia Medellin растворимый, 240г",829,,JULIUS MEINL,https://online.metro-cc.ru/products/240g-kofe-jardin-colombia-medellin-rastvorimyy
 231667,"Кофе Lebo Classic в зернах, 250г",339,469,MONARCH,https://online.metro-cc.ru/products/250g-kofe-lebo-classic-v-zernah
 221904,"Кофе Carraro Cafe crema в зернах, 1кг",1 619,,CARRARO,https://online.metro-cc.ru/products/1kg-kofe-carraro-caffe-crema-v-zernah
 215436,"Кофе Illy без кофеина в зернах, 250г",1 390,,LEBO CLASSIC,https://online.metro-cc.ru/products/kofe-illy-bez-kofeina-zernovoy-250g
 223097,"Кофе Jacobs Monarch в зернах, 230г",319,329,ABSOLUT,https://online.metro-cc.ru/products/230g-kofe-jacobs-monarch-zerno
 59570,"Кофе Жокей Caffe Italiano молотый, 250г",349,,ILLY,https://online.metro-cc.ru/products/art_50642
 59002,"Кофе Жокей классический в зернах, 900г",1 389,,BUSHIDO,https://online.metro-cc.ru/products/art_624061
 228420,"Кофе Poetti Daily Mokka в зернах, 1кг",1 599,,VERLE,https://online.metro-cc.ru/products/1kg-kofe-poetti-daily-mokka-v-zernah
 218855,"Кофе Lebo Gold в зернах, 1кг",1 549,1 789,CARTE NOIRE,https://online.metro-cc.ru/products/1kg-kofe-lebo-gold-v-zernah
 119131,"Кофе Жокей Фаворит растворимый, 95г",249,,ЖОКЕЙ,https://online.metro-cc.ru/products/95g-kofe-zhokey-favorit-rastvorimyy-stb
 221909,"Напиток кофейный MacCoffee Strong 3в1 порционный (16г x 100шт), 1.6кг",1 429,,LEBO,https://online.metro-cc.ru/products/5shth16g-kofe-maccoffee-3v1-strong-portsionnyy
 32458,"Кофе Egoiste Espresso в зернах, 250г",489,589,LAVAZZA,https://online.metro-cc.ru/products/egoiste-espresso-250g
 482361,"aro Кофе растворимый сублимированный, ст/б 80г",159,169,AMBASSADOR,https://online.metro-cc.ru/products/sublimirovannyj-aro-80g
 228239,"Кофе Bushido Specialty молотый, 227г",749,,JARDIN,https://online.metro-cc.ru/products/art_75973
 119130,"Кофе Jardin Espresso di Milano натуральный молотый жареный, 250г",459,,ЖОКЕЙ,https://online.metro-cc.ru/products/jardin-naturalnyj-zharenyj-espresso-di-milano-250g
 230304,"Кофе Illy Guatemala arabica selection в зернах, 250г",1 090,1 499,MONARCH,https://online.metro-cc.ru/products/v-zernah-illy-guatemala-zh-b-250-g
 226334,"Кофе в капсулах Julius Meinl Lungo Classico Bio для кофемашин Nespresso 10шт, 56г",619,,CARTE NOIRE,https://online.metro-cc.ru/products/julius-meinl-lungo-classico-10-56g
 226524,"Напиток кофейный Carte Noire Vanilla latte растворимый 20 пакетиков, 320г",689,,MACCOFFEE,https://online.metro-cc.ru/products/20shth16g-nap-kofeynyy-carte-noire-vanilla-latte-rastv-ports
 426443,"Кофе Italco Espresso Italiano в зернах, 1кг",1 499,,CARTE NOIRE,https://online.metro-cc.ru/products/1kg-kofe-italco-espresso-italiano-v-zernah
 224734,"Кофе Illy средней обжарки молотый, 250г",1 379,1 569,MONARCH,https://online.metro-cc.ru/products/illy-srednej-obzharki-250g
 224736,"Кофе Carte Noire Elegant растворимый, 95г",459,509,MONARCH,https://online.metro-cc.ru/products/95g-kofe-carte-noire-elegant-rastvorimyy-stb
 228419,"Кофе Jardin Oro в зернах, 1кг",2 239,,VERLE,https://online.metro-cc.ru/products/1kg-kofe-jardin-original-oro-zernovoy
 373045,"Кофе Черная Карта в зернах, 250г",219,299,ЖОКЕЙ,https://online.metro-cc.ru/products/250g-kofe-chernaya-karta-zerno
 615407,"Кофе Lebo Classic молотый для турки, 100г",119,139,JARDIN,https://online.metro-cc.ru/products/100g-lebo-classic-dlya-turki
 227972,"Кофе Jacobs Monarch растворимый сублимированный, 75г",262,,FRESCO,https://online.metro-cc.ru/products/jacobs-monarch-sublimirovannyj-75g
 228242,"Кофе Monarch Intense растворимый, 95г",439,,ЖОКЕЙ,https://online.metro-cc.ru/products/95g-kofe-monarch-intense-rastvorimyy-st
 50642,"Кофе Lebo Classic в зернах, 1кг",1 249,1 429,ЖОКЕЙ,https://online.metro-cc.ru/products/1kg-kofe-lebo-classic-v-zernah
 133724,"Кофе Monarch Original растворимый, 95г",439,,NESCAFE,https://online.metro-cc.ru/products/95g-kofe-monarch-original-rastvorimyy-st
 226505,"RIOBA Кофе в капсулах Decaffeinato без кофеина для кофемашин Nespresso 11шт, 55г",299,,MACCOFFEE,https://online.metro-cc.ru/products/rioba-dlya-kofemashin-decaffein-11x5g
 633254,"Кофе в капсулах Lebo Espresso Milky для кофемашин Nespresso 40шт, 220г",1 190,,JARDIN,https://online.metro-cc.ru/products/40shth55g-kofe-lebo-espresso-milky-banka
 119134,"Кофе Dallmayr Classic молотый, 250г",499,,JARDIN,https://online.metro-cc.ru/products/dallmayr-classic-250-g
 637205,"Кофе Jardin Guatemala Atitlan растворимый, 150г",499,,L'OR,https://online.metro-cc.ru/products/jardin-guatemala-atitlan-150g
 232413,"Кофе Lebo Принц Лебо молотый для турки, 100г",129,,ЖОКЕЙ,https://online.metro-cc.ru/products/100g-kofe-lebo-prints-lebo-molotyy-dturki
 228238,"Кофе Nescafe Classic растворимый, 190г",289,297,JARDIN,https://online.metro-cc.ru/products/nescafe-classic-paket-190g
 373046,"Кофе Bushido Red Katana в зернах, 227г",579,,ЖОКЕЙ,https://online.metro-cc.ru/products/art_59005
 604157,"Кофе в капсулах Verle Classic Mousse для кофемашин Nespresso 10шт, 55г",369,,NESCAFE,https://online.metro-cc.ru/products/kofe-verle-classic-mousse-v-kapsulah-55g-x-10sht-55g
 221910,"Кофе Dallmayr Prodomo жареный в зернах, 500г",1 149,,LEBO,https://online.metro-cc.ru/products/dallmayr-v-zernah-naturalnyj-zharenyj-prodomo-500g
 666415,"Кофе в капсулах L’or Espresso Lungo Profondo для кофемашин Nespresso 10шт, 52г",529,,JULIUS MEINL,https://online.metro-cc.ru/products/l-rsquoor-lungo-profondo-52-g
 230306,"Напиток кофейный MacCoffee 3в1 со сгущенным молоком порционный (20г x 10шт), 200г",141,,MONARCH,https://online.metro-cc.ru/products/10shth20g-kofe-maccoffee-3v1-sguschennoe-moloko-portsionnyy
 201556,"Кофе Жокей классический молотый натуральный жареный, 250г",349,,CARTE NOIRE,https://online.metro-cc.ru/products/zhokej-naturalnyj-zharenyj-klassicheskij-250g
 231666,"Кофе Monarch Velour растворимый, 95г",489,,MONARCH,https://online.metro-cc.ru/products/kofe-monarch-velour-rastvorimyy-95g
 232416,"Напиток кофейный MacCoffee Capuccino Dolce Vita порционный (24г x 20шт), 480г",309,,ЖОКЕЙ,https://online.metro-cc.ru/products/20shth24g-kofe-maccoffee-cappuccino-dolce-vita-portsionnyy
 218638,"Кофе Jardin Americano Crema натуральный жареный молотый, 250г",459,,NESCAFE,https://online.metro-cc.ru/products/jardin-almericano-crema-naturalnyj-zharenyj-250g
 230293,"Кофе Julius Meinl Король Хадрамаут в зернах, 250г",899,969,MONARCH,https://online.metro-cc.ru/products/julius-meinl-korol-hadramut-250g
 228236,"Кофе Jardin Gold растворимый, 190г",759,,JARDIN,https://online.metro-cc.ru/products/190g-kofe-jardin-gold-rastvorimyy-stb
 226343,"Кофе Egoiste Velvet растворимый, 95г",899,1 129,LEBO,https://online.metro-cc.ru/products/egoiste-velvet-95g
 76036,"Кофе Bushido Kodo растворимый, 95г",899,,JACOBS,https://online.metro-cc.ru/products/bushido-v-kristallah-kodo-95g
 228230,"Кофе Jacobs Millicano молотый в растворимом, 90г",469,,JARDIN,https://online.metro-cc.ru/products/90g-jacobs-millicano-molotyj
 376496,"Кофе Fresco Arabica Blend в зернах, 200г",214,,KIMBO,https://online.metro-cc.ru/products/200g-kofe-fresco-arabica-blend-zerno
 104611,"Кофе Jardin Guatemala Atitlan растворимый, 190г",849,,JULIUS MEINL,https://online.metro-cc.ru/products/190g-kofe-jardin-guatemala-atitlan-rastvorimyy-stb
 44940,"Кофе Monarch Milligrano растворимый с добавлением молотого, 120г",559,,DALLMAYR,https://online.metro-cc.ru/products/120g-kofe-monarch-miligrano-rastv-c-dob-molotogo
 544095,"Кофе Жокей триумф растворимый (2г x 100шт), 200г",709,,ЖОКЕЙ,https://online.metro-cc.ru/products/100shth2g-kofe-zhokey-triumf-rastvorimyy
 133441,"Кофе в капсулах Carte Noire Colombia Origin для кофемашин Nespresso 10шт, 52г",689,,RIOBA,https://online.metro-cc.ru/products/10shth52g-kofe-carte-noire-colombia-origin-v-kapsulah
 228291,"Кофе в капсулах Carte Noire Riche Espresso для кофемашин Nespresso 10шт, 52г",689,,EGOISTE,https://online.metro-cc.ru/products/10shth52g-kofe-carte-noire-riche-espresso-v-kapsulah
 230298,"Кофе Bushido Specialty в зернах, 227г",709,,MONARCH,https://online.metro-cc.ru/products/bushido-specialty-227g-75962
 133790,"Кофе в капсулах Carte Noire Lungo Profond для кофемашин Nespresso 10шт, 52г",689,,JACOBS,https://online.metro-cc.ru/products/10shth52g-kofe-carte-noire-lungo-profond-v-kapsulah
 234805,"Кофе в капсулах Carraro Ristretto для кофемашин Nespresso 10шт, 55г",369,399,ЖОКЕЙ,https://online.metro-cc.ru/products/10shtx55g-kofe-carraro-v-alyum-kapsulah-ristretto
 634928,"Кофе Jardin Columbia Supremo молотый, 250г",479,,ЧЕРНАЯ КАРТА,https://online.metro-cc.ru/products/250g-jardin-kolumbiya-supremo-mol
 611604,"Кофе Lebo Classic Original жареный в зернах, 100г",119,154,ILLY,https://online.metro-cc.ru/products/100g-kofe-lebo-original-zharenyy-v-zernah
 228811,"Кофе Жокей Gold растворимый, 95г",279,,FORT,https://online.metro-cc.ru/products/95g-kofe-zhokey-gold-rastvorimyy-stb
 223096,"Кофе Jacobs Day&Night сублимированный без кофеина, 95г",519,,ABSOLUT,https://online.metro-cc.ru/products/kofe-jacobs-dayampnight-sublimirovannyy-bez-kofeina-95g
 227971,"Кофе Tchibo Gold selection растворимый, 150г",529,,FRESCO,https://online.metro-cc.ru/products/150g-kofe-tchibo-gold-selection-rastvorimyy
 44435,"Кофе Tchibo Gold selection растворимый, 95г",399,,DALLMAYR,https://online.metro-cc.ru/products/95g-kofe-tchibo-gold-selection-rastvorimyy-stb
 599071,"Кофе Carte Noire Original растворимый сублимированный, 75г",690,,JARDIN,https://online.metro-cc.ru/products/art_426443
 119132,"Кофе Jardin Gold растворимый, 240г",859,,ЖОКЕЙ,https://online.metro-cc.ru/products/240g-kofe-jardin-gold-rastvorimyy
 228441,"Кофе Жокей По-восточному молотый, 450г",679,,VERLE,https://online.metro-cc.ru/products/450g-zhokej-po-vostochnomu-mol
 226350,"Кофе Жокей Классический молотый, 450г",679,,JACOBS,https://online.metro-cc.ru/products/450g-zhokej-klassicheskij-mol
 218856,"Кофе Jacobs Hazelnut с ароматом лесного ореха растворимый, 95г",509,,CARTE NOIRE,https://online.metro-cc.ru/products/95g-jacobs-s-aromatom-oreha
 581766,"Кофе Fresco Arabica solo молотый для чашек и турок, 250г",489,,CARTE NOIRE,https://online.metro-cc.ru/products/kofe-fresco-arabica-solo-molotyy-dlya-chashek-i-turok-250g
 224739,"Кофе Carte Noire растворимый (1.8г х 26шт), 47г",629,,MONARCH,https://online.metro-cc.ru/products/rastvorimyj-carte-noire-v-paketikah-18g-26
 218711,"Кофе в капсулах Julius Meinl Espresso Crema Bio для кофемашин Nespresso 10шт, 56г",619,,POETTI,https://online.metro-cc.ru/products/julius-meinl-espresso-krema-10sht
 629006,"Кофе Jacobs Barista Editions Crema молотый, 230г",629,,KIMBO,https://online.metro-cc.ru/products/230g-kofe-jacobs-barista-editions-crema-molotyy
 122026,"Кофе Nescafe Classic растворимый, 190г",509,,JACOBS,https://online.metro-cc.ru/products/190g-kofe-nescafe-classic-rastvorimyy-stekl-banka
 214904,"Кофе Жокей Триумф растворимый, 75г",199,,FRESCO,https://online.metro-cc.ru/products/75g-kofe-zhokey-triumf-rastvorimyy
 226338,"Кофе в капсулах Lebo Latte macchiato для кофемашин Dolce Gusto 16шт, 172г",849,,CARTE NOIRE,https://online.metro-cc.ru/products/8shth65g8shth15g-kofe-lebo-latte-macchiato-v-kapsulah
 88215,"Кофе Fresco Arabica blend растворимый, 190г",709,,JULIUS MEINL,https://online.metro-cc.ru/products/kofe-fresco-arabica-blend-rastvorimyy-190g
 218710,"Кофе Черная Карта молотый для турки, 250г",291,,POETTI,https://online.metro-cc.ru/products/250-kofe-chernaya-karta-molotyy-dlya-turki
 226341,"Кофе в капсулах Jacobs Lungo 8 Intenso для кофемашин Nespresso 10шт, 52г",419,,LEBO,https://online.metro-cc.ru/products/10shth52g-kofe-jacobs-lungo-8-intenso-v-kapsulah
 624061,"Кофе Poetti Leggenda Original в зернах, 250г",539,,ЖОКЕЙ,https://online.metro-cc.ru/products/250g-kofe-poetti-leggenda-original-v-zernah
 228235,"Кофе в капсулах L’or Espresso Splendente для кофемашин Nespresso 10шт, 52г",529,,JARDIN,https://online.metro-cc.ru/products/lor-espresso-52-g
 373043,"Кофе в капсулах L’or Espresso Forza для кофемашин Nespresso 10шт, 52г",529,,JARDIN,https://online.metro-cc.ru/products/l-rsquoor-espr-forza-52-g
 469154,"Кофе Jacobs Gold растворимый сублимированный, 95г",499,,ЧЕРНАЯ КАРТА,https://online.metro-cc.ru/products/jacobs-sublimirovannyj-gold-95g
 426452,"Кофе Monarch Brazilian Selection молотый, 230г",499,,JACOBS,https://online.metro-cc.ru/products/230g-kofe-monarch-brazilian-selection-molotyy
 230024,"Кофе Monarch Original жареный молотый, 230г",509,,ILLY,https://online.metro-cc.ru/products/230g-kofe-monarch-original-zharenyy-molotyy
 213623,"Кофе Carte Noire Original молотый, 230г",449,529,JULIUS MEINL,https://online.metro-cc.ru/products/230g-kofe-carte-noire-original-molotyy
 206309,"Кофе Жокей классический 3в1 растворимый (12г x 50шт), 600г",429,499,ORIGO,https://online.metro-cc.ru/products/kofe-zhokey-klassicheskiy-3v1-rastvorimyy-12g-x-50sht-600g
 227973,"Кофе Verle Africa в дрип-пакетах 6шт, 66г",429,,FRESCO,https://online.metro-cc.ru/products/6shth11g-kofe-verle-africa-v-drip-paketah
 218714,"Кофе MacCoffee Arabica растворимый, 100г",259,,POETTI,https://online.metro-cc.ru/products/100g-kofe-maccoffee-arabica-rastvorimyy-stb
 658721,"Кофе Jardin Gold растворимый, 95г",329,,KIMBO,https://online.metro-cc.ru/products/95g-kofe-jardin-gold-rastvorimyy-stb
 423210,"Кофе Ambassador Platinum растворимый, 150г",399,429,FRESCO,https://online.metro-cc.ru/products/ambassador-platinum-150g
 636530,"Кофе Tchibo Gold selection молотый, 250г",379,,EGOISTE,https://online.metro-cc.ru/products/250g-kofe-tchibo-gold-selection-molotyy
 59003,"Кофе Черная Карта Brasilia Exclusive растворимый сублимированный, 95г",369,,BUSHIDO,https://online.metro-cc.ru/products/chernaya-karta-sublimirovannyj-brasilia-exclusive-95g
 206308,"Кофе Jardin Original Oro молотый, 250г",579,,ORIGO,https://online.metro-cc.ru/products/250g-kofe-jardin-original-oro-molotyy
 224738,"Кофе MacCoffee Gold растворимый, 100г",247,,MONARCH,https://online.metro-cc.ru/products/100g-kofe-maccoffee-gold-rastvorimyy-stb
 226336,"Кофе Jardin Колумбия Меделлин растворимый, 75г",249,,JACOBS,https://online.metro-cc.ru/products/75g-kofe-jardin-kolumbiya-medellin-rastvorimyy
 95644,"Кофе Жокей Импер растворимый, 95г",239,,JACOBS,https://online.metro-cc.ru/products/art_599055
