 469154,"Кофе Жокей Импер растворимый, 95г",239,,ЧЕРНАЯ КАРТА,https://online.metro-cc.ru/products/art_599055
 226336,"Кофе Жокей Imperial растворимый, 75г",199,,JACOBS,https://online.metro-cc.ru/products/75g-kofe-zhokey-imper-rastvorimyy
 100815,"Кофе Жокей Триумф растворимый сублимированный, 95г",279,,JULIUS MEINL,https://online.metro-cc.ru/products/zhokej-triumf-95g
 226524,"Кофе Alta Roma Caffe Latte молотый, 250г",289,,MACCOFFEE,https://online.metro-cc.ru/products/kofe-alta-roma-caffe-latte-molotiy-250g
 599071,"Кофе Jardin Гватемала Атитлан растворимый, 75г",229,,JARDIN,https://online.metro-cc.ru/products/75g-kofe-jardin-gvatemala-atitlan-rastvorimyy
 228238,"Кофе Jardin Эспрессо ди Милано в зернах, 1кг",1 399,1 479,JARDIN,https://online.metro-cc.ru/products/jardin-v-zernah-naturalnyj-zharenyj-espresso-di-milano-1kg
 598758,"Кофе Poetti Leggenda Original в зернах, 1кг",2 189,,JACOBS,https://online.metro-cc.ru/products/1kg-kofe-poetti-leggenda-original-v-zernah
 119131,"Кофе Egoiste Voyage в зернах, 1кг",2 649,,ЖОКЕЙ,https://online.metro-cc.ru/products/1kg-kofe-egoiste-voyage-v-zernah
 75973,"Кофе Carte Noire Intense Absolu в зернах, 800г",2 199,,BUSHIDO,https://online.metro-cc.ru/products/800g-kofe-carte-noire-intense-absolu-zernovoy
 227974,"Кофе Nescafe Gold растворимый сублимированный, 500г",1 829,,FRESCO,https://online.metro-cc.ru/products/nescafe-sublimirovannyj-gold-500g
 218638,"Кофе в капсулах L’or Espresso Ristretto для кофемашин Nespresso 10шт, 52г",529,,NESCAFE,https://online.metro-cc.ru/products/l-rsquoor-ristretto-52-g
 226522,"Кофе Illy темная обжарка в зернах, 250г",1 090,1 499,MACCOFFEE,https://online.metro-cc.ru/products/v-zernah-illy-temnaya-obzharka-250g
 226346,"Кофе Poetti Leggenda Oro в зернах, 1кг",2 089,,LEBO,https://online.metro-cc.ru/products/1kg-kofe-poetti-leggenda-oro-v-zernah
 633254,"Кофе Nescafe Gold растворимый сублимированный с добавлением натурального жареного молотого кофе, 900г",2 849,,JARDIN,https://online.metro-cc.ru/products/kofe-nescafe-gold-rastvorimiy-sublimirovanniy-s-dobavleniem-naturalnogo-zharenogo-molotogo-kofe-900g
 75962,"Кофе Monarch Brazilian Selection растворимый, 180г",1 029,,BUSHIDO,https://online.metro-cc.ru/products/kofe-monarch-brazilian-selection-rastvorimyy-180g
 230306,"Кофе Kimbo Integrity Bio в зернах, 1кг",2 349,,MONARCH,https://online.metro-cc.ru/products/kimbo-integrity-bio-1-kg
 228291,"Кофе Monarch Milligrano растворимый с молотым, 200г",449,509,EGOISTE,https://online.metro-cc.ru/products/kofe-monarch-milligrano-rastvorimyy-s-molotym-200g
 604157,"Кофе Julius Meinl Президент классическая коллекция в зернах, 250г",409,499,NESCAFE,https://online.metro-cc.ru/products/julius-meinl-president-250g
 636530,"Кофе Nescafe Gold Barista растворимый, 85г",279,329,EGOISTE,https://online.metro-cc.ru/products/nescafe-gold-v-rastvorimom-barista-85g
 637205,"Напиток кофейный MacCoffee The Original coffee mix 3 в 1 растворимый 100 пакетиков, 2кг",1 639,,L'OR,https://online.metro-cc.ru/products/maccoffee-napitok-kofejnyj-porcionnyj-the-original-coffee-mix-3v1-100-20g
 227971,"Напиток кофейный Jacobs 3в1 Крепкий 50 пакетиков, 675г",589,779,FRESCO,https://online.metro-cc.ru/products/napitok-kofeynyy-jacobs-3v1-krepkiy-50x135g
 120797,"Кофе Alta Roma Caffe Latte в зернах, 1кг",919,1 359,JACOBS,https://online.metro-cc.ru/products/kofe-alta-roma-caffe-latte-v-zernakh-1kg
 206308,"Кофе в капсулах Absolut Drive Americano Original для кофемашин Dolce Gusto 16шт, 128г",359,429,ORIGO,https://online.metro-cc.ru/products/16shth8g-kofe-absolut-amerikano-kapsuly-dg
 226334,"Кофе Jacobs Monarch Классический в зернах, 800г",989,1 159,CARTE NOIRE,https://online.metro-cc.ru/products/jacobs-monarch-klassicheskij-v-zernah-800-g
 70176,"Кофе Carte Noire Original растворимый сублимированный, 150г",1 190,,NESCAFE,https://online.metro-cc.ru/products/carte-noire-sublimirovannyj-original-150g
 215436,"RIOBA Кофе в капсулах Dolce Gusto Latte Macciato 8 порций 16 капсул, 192г",419,,LEBO CLASSIC,https://online.metro-cc.ru/products/192g-kofe-v-kaps-rioba-dolce-gusto-latte-macc
 298849,"Кофе Poetti Daily Mokka молотый, 250г",349,,DALLMAYR,https://online.metro-cc.ru/products/250g-kofe-poetti-daily-mokka-molotyy
 228441,"Кофе Monarch Original растворимый, 130г",399,,VERLE,https://online.metro-cc.ru/products/kofe-monarch-original-rastvorimyy-130g
 223096,"Кофе Nescafe Classic растворимый, 500г",1 059,,ABSOLUT,https://online.metro-cc.ru/products/nescafe-classic-paket-500g
 228239,"Кофе Kimbo Superior Blend натуральный жареный в зернах, 1кг",2 109,,JARDIN,https://online.metro-cc.ru/products/kimbo-v-zernah-naturalnyj-zharenyj-superior-blend-1kg
 226341,"Кофе Poetti Leggenda Ruby в зернах, 1кг",2 189,,LEBO,https://online.metro-cc.ru/products/1kg-kofe-poetti-leggenda-ruby-v-zernah
 581769,"Кофе Origo Professional Master эспрессо в зернах, 1кг",2 029,,JACOBS,https://online.metro-cc.ru/products/1kg-kofe-origo-professional-master-espresso-zerno
 228420,"Кофе Monarch Brazilian Selection в зернах, 800г",1 569,,VERLE,https://online.metro-cc.ru/products/800g-kofe-monarch-brazilian-selection-zerno
 226466,"Кофе Carte Noire Crema Delice в зернах, 800г",2 199,,ALTA ROMA,https://online.metro-cc.ru/products/800g-kofe-carte-noire-crema-delice-zerno
 376496,"Кофе Жокей Традиционный в зернах, 900г",1 079,,KIMBO,https://online.metro-cc.ru/products/zhokej-tradicionnyj-900g
 228236,"Кофе Tchibo Gold мокка молотый, 250г",309,,JARDIN,https://online.metro-cc.ru/products/250g-kofe-tchibo-gold-mokka-molotyy
 231667,"Кофе Carraro Qualita Oro в зернах, 500г",1 179,,MONARCH,https://online.metro-cc.ru/products/v-zernah-carraro-qualita-oro-500-g
 230300,"Кофе Jacobs Caramel с ароматом карамели растворимый, 95г",509,,MONARCH,https://online.metro-cc.ru/products/95g-jacobs-s-arom-karameli
 231666,"Кофе Piazza del Caffe Crema Vellutata в зернах, 1кг",1 159,,MONARCH,https://online.metro-cc.ru/products/1kg-kofe-piazza-del-caffe-crema-vellutata-zerno
 226467,"Кофе Черная Карта молотый жареный, 250г",229,289,ALTA ROMA,https://online.metro-cc.ru/products/250g-kofe-chernaya-karta-molotyy-zharenyy
 60434,"Кофе Jardin Kenya Kilimanjaro растворимый сублимированный, 150г",499,,KIMBO,https://online.metro-cc.ru/products/jardin-kenya-kilimanjaro-sublimirovannyj-150g
 616531,"Кофе Жокей Триумф растворимый, 280г",739,,ЖОКЕЙ,https://online.metro-cc.ru/products/280g-kofe-zhokey-triumf-rastvorimyy
 228242,"Кофе Jardin Kenya Kilimanjaro растворимый, 75г",229,,ЖОКЕЙ,https://online.metro-cc.ru/products/75g-kofe-jardin-keniya-kilimandzharo-rastvorimyy
 229166,"Кофе Jacobs Brazilian Selection растворимый, 180г",609,,TCHIBO,https://online.metro-cc.ru/products/180g-kofe-jacobs-brazilian-selection-rastvorimyy
 228235,"Кофе Julius Meinl Prasident молотый, 250г",529,,JARDIN,https://online.metro-cc.ru/products/julius-meinl-president-classic-collection-250g
 59000,"Кофе Jacobs Velour растворимый, 95г",499,,EGOISTE,https://online.metro-cc.ru/products/95g-kofe-jacobs-velour-rastvorimyy-poroshkoobraznyy-stb
 226509,"Кофе в капсулах Verle Classic Decaf для кофемашин Nespresso 10шт, 55г",399,,MACCOFFEE,https://online.metro-cc.ru/products/kofe-verle-classic-decaf-v-kapsulah-55g-x-10sht-55g
 229165,"Кофе Monarch Original растворимый, 47.5г",199,239,TCHIBO,https://online.metro-cc.ru/products/475g-kofe-monarch-original-rastvorimyy-st
 122026,"Кофе Jacobs Monarch растворимый, 270г",1 199,,JACOBS,https://online.metro-cc.ru/products/270g-jacobs-monarch
 224738,"Кофе Жокей Фаворит растворимый гранулированный, 75г",251,,MONARCH,https://online.metro-cc.ru/products/zhokej-favorit-granulirovannyj150-g
 384385,"Кофе Jacobs Monarch растворимый сублимированный, 190г",899,,JACOBS,https://online.metro-cc.ru/products/jacobs-monarch-sublimirovannyj-190g
 112991,"Кофе Жокей триумф растворимый, 450г",1 099,,CARRARO,https://online.metro-cc.ru/products/450g-kofe-zhokey-triumf-rastvorimyy
 611604,"Кофе Jacobs Monarch растворимый сублимированный, 48г",299,,ILLY,https://online.metro-cc.ru/products/jacobs-monarch-sublimirovannyj-475g
